This image was saved from this machine with hard drive S.M.A.R.T. info at 2022-0208-1522:
*****************************************************.
For the drive: /dev/sda
smartctl 7.2 2020-12-30 r5155 [x86_64-linux-5.10.0-8-amd64] (local build)
Copyright (C) 2002-20, Bruce Allen, Christian Franke, www.smartmontools.org

=== START OF INFORMATION SECTION ===
Device Model:     240GB SSD
Serial Number:    LJS946R002784
LU WWN Device Id: 5 02b2a2 01d1c1b1a
Add. Product Id:  mavlsata
Firmware Version: V4.25.0
User Capacity:    240,057,409,536 bytes [240 GB]
Sector Size:      512 bytes logical/physical
Rotation Rate:    Solid State Device
TRIM Command:     Available
Device is:        Not in smartctl database [for details use: -P showall]
ATA Version is:   ACS-3 T13/2161-D revision 4
SATA Version is:  SATA 3.2, 6.0 Gb/s (current: 6.0 Gb/s)
Local Time is:    Tue Feb  8 15:22:15 2022 UTC
SMART support is: Available - device has SMART capability.
SMART support is: Enabled

=== START OF READ SMART DATA SECTION ===
SMART overall-health self-assessment test result: PASSED

General SMART Values:
Offline data collection status:  (0x02)	Offline data collection activity
					was completed without error.
					Auto Offline Data Collection: Disabled.
Self-test execution status:      (   0)	The previous self-test routine completed
					without error or no self-test has ever 
					been run.
Total time to complete Offline 
data collection: 		(    0) seconds.
Offline data collection
capabilities: 			 (0x75) SMART execute Offline immediate.
					No Auto Offline data collection support.
					Abort Offline collection upon new
					command.
					No Offline surface scan supported.
					Self-test supported.
					Conveyance Self-test supported.
					Selective Self-test supported.
SMART capabilities:            (0x0002)	Does not save SMART data before
					entering power-saving mode.
					Supports SMART auto save timer.
Error logging capability:        (0x00)	Error logging NOT supported.
					General Purpose Logging supported.
Short self-test routine 
recommended polling time: 	 (   2) minutes.
Extended self-test routine
recommended polling time: 	 (  90) minutes.
Conveyance self-test routine
recommended polling time: 	 (   2) minutes.

SMART Attributes Data Structure revision number: 5
Vendor Specific SMART Attributes with Thresholds:
ID# ATTRIBUTE_NAME          FLAG     VALUE WORST THRESH TYPE      UPDATED  WHEN_FAILED RAW_VALUE
  5 Reallocated_Sector_Ct   0x0033   100   100   010    Pre-fail  Always       -       0
  9 Power_On_Hours          0x0033   100   100   010    Pre-fail  Always       -       579
 12 Power_Cycle_Count       0x0033   100   100   010    Pre-fail  Always       -       27
161 Unknown_Attribute       0x0033   100   100   010    Pre-fail  Always       -       0
164 Unknown_Attribute       0x0033   100   100   010    Pre-fail  Always       -       1208
165 Unknown_Attribute       0x0033   100   100   010    Pre-fail  Always       -       2
166 Unknown_Attribute       0x0033   100   100   010    Pre-fail  Always       -       0
167 Unknown_Attribute       0x0033   100   100   010    Pre-fail  Always       -       1
169 Unknown_Attribute       0x0033   100   100   010    Pre-fail  Always       -       0
176 Erase_Fail_Count_Chip   0x0033   100   100   010    Pre-fail  Always       -       0
177 Wear_Leveling_Count     0x0033   100   100   010    Pre-fail  Always       -       0
178 Used_Rsvd_Blk_Cnt_Chip  0x0033   100   100   010    Pre-fail  Always       -       0
192 Power-Off_Retract_Count 0x0033   100   100   010    Pre-fail  Always       -       0
194 Temperature_Celsius     0x0033   100   100   010    Pre-fail  Always       -       48
195 Hardware_ECC_Recovered  0x0033   100   100   010    Pre-fail  Always       -       0
199 UDMA_CRC_Error_Count    0x0033   100   100   010    Pre-fail  Always       -       0
241 Total_LBAs_Written      0x0033   100   100   010    Pre-fail  Always       -       97
242 Total_LBAs_Read         0x0033   100   100   010    Pre-fail  Always       -       68
243 Unknown_Attribute       0x0033   100   100   010    Pre-fail  Always       -       0
244 Unknown_Attribute       0x0033   100   100   010    Pre-fail  Always       -       0
245 Unknown_Attribute       0x0033   100   100   010    Pre-fail  Always       -       0
246 Unknown_Attribute       0x0033   100   100   010    Pre-fail  Always       -       0
248 Unknown_Attribute       0x0033   100   100   010    Pre-fail  Always       -       0
249 Unknown_Attribute       0x0033   100   100   010    Pre-fail  Always       -       0
250 Read_Error_Retry_Rate   0x0033   100   100   010    Pre-fail  Always       -       0
251 Unknown_Attribute       0x0033   100   100   010    Pre-fail  Always       -       0
252 Unknown_Attribute       0x0033   100   100   010    Pre-fail  Always       -       0
253 Unknown_Attribute       0x0033   100   100   010    Pre-fail  Always       -       0
254 Unknown_SSD_Attribute   0x0033   100   100   010    Pre-fail  Always       -       0

SMART Error Log not supported

SMART Self-test log structure revision number 1
No self-tests have been logged.  [To run self-tests, use: smartctl -t]

SMART Selective self-test log data structure revision number 1
 SPAN  MIN_LBA  MAX_LBA  CURRENT_TEST_STATUS
    1        0        0  Not_testing
    2        0        0  Not_testing
    3        0        0  Not_testing
    4        0        0  Not_testing
    5        0        0  Not_testing
Selective self-test flags (0x0):
  After scanning selected spans, do NOT read-scan remainder of disk.
If Selective self-test is pending on power-up, resume after 0 minute delay.

